Indicator Name,1960,1961,1962,1963,1964,1965,1966,1967,1968,1969,1970,1971,1972,1973,1974,1975,1976,1977,1978,1979,1980,1981,1982,1983,1984,1985,1986,1987,1988,1989,1990,1991,1992,1993,1994,1995,1996,1997,1998,1999,2000,2001,2002,2003,2004,2005,2006,2007,2008,2009,2010,2011,2012,2013,2014,2015,2016,2017
"Presence of peace keepers (number of troops, police, and military observers in mandate)",,,,,,,,,,,,,,,,,,,,,,,,,,,,,,,,,,,,,,,,,,,,,,,,,,17,16,16,16,14,16,16,14,17
"Intentional homicides (per 100,000 people)",,,,,,,,,,,,,,,,,,,,,,,,,,,,,,,,,,,,,,,,,,,,,,,,,6.46681351483905,4.14425645794374,5.96954406199315,3.46175321049693,4.98559716374917,2.24768378926594,2.25052146229004,1.66500166500167,1.59674044708733,
"Intentional homicides, male (per 100,000 male)",,,,,,,,,,,,,,,,,,,,,,,,,,,,,,,,,,,,,,,,,,,,,,,,,,,,,,,,,,
"Intentional homicides, female (per 100,000 female)",,,,,,,,,,,,,,,,,,,,,,,,,,,,,,,,,,,,,,,,,,,,,,,,,,,,,,,,,,
"Internally displaced persons, total displaced by conflict and violence (number of people)",,,,,,,,,,,,,,,,,,,,,,,,,,,,,,,,,,,,,,,,,,,,,,,,,,20000,18000,18000,18000,17000,17000,17000,17000,16000
"Internally displaced persons, new displacement associated with disasters (number of cases)",,,,,,,,,,,,,,,,,,,,,,,,,,,,,,,,,,,,,,,,,,,,,,,,,,,,,,1000,,,10,
"Internally displaced persons, new displacement associated with conflict and violence (number of cases)",,,,,,,,,,,,,,,,,,,,,,,,,,,,,,,,,,,,,,,,,,,,,,,,,,,,,,,,,,
Battle-related deaths (number of people),,,,,,,,,,,,,,,,,,,,,,,,,,,,,,,,,,,,,,,,,,,,,,,,,,,,,,,,,,
Travel services (% of commercial service exports),,,,,,,,,,,,,,,,,,,,,,,,,,,,,,,,,,,,,,,,,,,,,44.8169875716392,48.4550072654441,48.23374216143,41.1774408535401,41.0222978662492,63.1213054267181,63.9616977821661,69.3829633939724,74.5104450243758,77.4148327180831,74.5583750605222,78.5391800756663,82.3990917362942,83.3945461102704
Transport services (% of commercial service exports),,,,,,,,,,,,,,,,,,,,,,,,,,,,,,,,,,,,,,,,,,,,,30.3511309499323,29.5578109224765,31.6845419342064,11.6828749707479,8.68074355379643,6.8319443266487,6.11782658630152,3.68205956505977,3.48840025491955,4.36351508390064,2.96671571900525,3.6084872048617,3.21793194426054,2.82971262496791
High-technology exports (% of manufactured exports),,,,,,,,,,,,,,,,,,,,,,,,,,,,,,,,,,,,,,,,,,,,,,,,,,,,,,,,,,
High-technology exports (current US$),,,,,,,,,,,,,,,,,,,,,,,,,,,,,,,,,,,,,,,,,,,,,,,,,,,,,,,,,,
Commercial service exports (current US$),,,,,,,,,,,,,,,,,,,,,,,,,,,,,,,,,,,,,,,,,,,,,203433206.285007,226305294.618969,284166472.042279,370543781.83664,488508564.83316,615136332.28937,674595297.597472,1076911407.19588,1082740271.85749,1107662374.99438,1187817441.93403,1018035321.40086,1216539587.52327,1490708436.25064
"Computer, communications and other services (% of commercial service exports)",,,,,,,,,,,,,,,,,,,,,,,,,,,,,,,,,,,,,,,,,,,,,19.0422089530106,16.8520898182059,14.6413342028478,42.3432013933636,45.876507219471,25.5179759797154,26.1775656104511,25.1014437789297,18.926246071126,15.2727343440322,20.0299807447049,15.8171168525634,12.5930271064213,12.2164545344743
Export value index (2000 = 100),,,,,,,,,,,,,,,,,,,,,,,,,,,,,,,,,,,,,,,,,,,,,,,,,,,,,,,,,,
Merchandise exports to low- and middle-income economies within region (% of total merchandise exports),,,,,,,,,,,,,,,,,,,,,,,,,,,,,,,,,,,,,,,,,,,,,,,,,60.0588112979208,60.7515991975403,60.9359400676963,60.7406902446683,64.1760011910316,63.9810152736388,62.9367975873054,63.1797672705858,66.9353657862878,
Merchandise exports by the reporting economy (current US$),,,,,,,,,,,,,,,,,,,,,,,,,,,,,,,,,,,,,,,,,,,,,,,,,279639807,225298777,378601165,429589700,374653351,410125058,439567618,371342919,342571275,
"Merchandise exports by the reporting economy, residual (% of total merchandise exports)",,,,,,,,,,,,,,,,,,,,,,,,,,,,,,,,,,,,,,,,,,,,,,,,,0,0,0,0,0,0,0,0,0.005307216724461,
Merchandise exports to low- and middle-income economies in Sub-Saharan Africa (% of total merchandise exports),,,,,,,,,,,,,,,,,,,,,,,,,,,,,,,,,,,,,,,,,,,,,,,,,3.64954621786018,3.58624405670875,3.5694002684857,3.58724056931533,3.27334587219534,3.29116222886337,3.38657566900208,3.36437518012832,1.130556261613,
Merchandise exports to low- and middle-income economies in South Asia (% of total merchandise exports),,,,,,,,,,,,,,,,,,,,,,,,,,,,,,,,,,,,,,,,,,,,,,,,,4.97571112971051,4.8894060352578,4.86644170785898,4.89076483910112,4.46280780763656,4.48709793294318,4.61718269702023,4.58691444712859,3.05445925085225,
Merchandise exports to low- and middle-income economies in Middle East & North Africa (% of total merchandise exports),,,,,,,,,,,,,,,,,,,,,,,,,,,,,,,,,,,,,,,,,,,,,,,,,0.580374810514728,0.570308466432554,0.56763058296453,0.57046688968567,0.520549461200468,0.52338279705894,0.538555822371793,0.535026224641704,0.482160683203809,
Merchandise exports to low- and middle-income economies in Latin America & the Caribbean (% of total merchandise exports),,,,,,,,,,,,,,,,,,,,,,,,,,,,,,,,,,,,,,,,,,,,,,,,,0.0198934481456,0.019546488705529,0.019455566123258,0.019554239778095,0.017842893923562,0.017939893835992,0.018459731035056,0.018339382957239,0.061196607917579,
Merchandise exports to low- and middle-income economies in Europe & Central Asia (% of total merchandise exports),,,,,,,,,,,,,,,,,,,,,,,,,,,,,,,,,,,,,,,,,,,,,,,,,60.0588112979208,60.7515991975403,60.9359400676963,60.7406902446683,64.1760011910316,63.9810152736388,62.9367975873054,63.1797672705858,66.9353657862878,
Merchandise exports to low- and middle-income economies in East Asia & Pacific (% of total merchandise exports),,,,,,,,,,,,,,,,,,,,,,,,,,,,,,,,,,,,,,,,,,,,,,,,,,,,,,,,,3.67004618236015,
Merchandise exports to low- and middle-income economies outside region (% of total merchandise exports),,,,,,,,,,,,,,,,,,,,,,,,,,,,,,,,,,,,,,,,,,,,,,,,,9.22552560623102,9.06550504710463,9.02292812543247,9.06802653788021,8.27454603495592,8.31958285270148,8.56077391942916,8.50465523485584,8.39841898594679,
Merchandise exports to high-income economies (% of total merchandise exports),,,,,,,,,,,,,,,,,,,,,,,,,,,,,,,,,,,,,,,,,,,,,,,,,30.7156630958482,30.1828957553551,30.0411318068712,30.1912832174514,27.5494527740124,27.6994018736597,28.5024284932654,28.3155774945583,24.6609080110409,
Merchandise exports (current US$),,,,,,,,,,,,,,,,,,,,,,,,,,,,,,,,,,,,,,,,,,,,,,,,,,,,,,,,,,
Merchandise exports to economies in the Arab World (% of total merchandise exports),,,,,,,,,,,,,,,,,,,,,,,,,,,,,,,,,,,,,,,,,,,,,,,,,1.14570812874292,1.1258365596898,1.12054937812989,1.12614897424217,1.02760831838923,1.03320095111087,1.0631542926804,1.05618494370698,0.800332719081598,
Ores and metals exports (% of merchandise exports),,,,,,,,,,,,,,,,,,,,,,,,,,,,,,,,,,,,,,,,,,,,,,,,,,,,,,,,,,
Manufactures exports (% of merchandise exports),,,,,,,,,,,,,,,,,,,,,,,,,,,,,,,,,,,,,,,,,,,,,,,,,,,,,,,,,,
Insurance and financial services (% of commercial service exports),,,,,,,,,,,,,,,,,,,,,,,,,,,,,,,,,,,,,,,,,,,,,5.7896725254179,5.13509199387354,5.44038170151578,4.79648278234844,4.42045136048338,4.52877426691777,3.74291002108134,1.83353326203817,3.07490864957865,2.94891785398398,2.44492847576767,2.03521586690856,1.78994921302402,1.55928673028738
ICT goods exports (% of total goods exports),,,,,,,,,,,,,,,,,,,,,,,,,,,,,,,,,,,,,,,,,,,,,,,,,,,,,,,,,,
Fuel exports (% of merchandise exports),,,,,,,,,,,,,,,,,,,,,,,,,,,,,,,,,,,,,,,,,,,,,,,,,,,,,,,,,,
Food exports (% of merchandise exports),,,,,,,,,,,,,,,,,,,,,,,,,,,,,,,,,,,,,,,,,,,,,,,,,,,,,,,,,,
Agricultural raw materials exports (% of merchandise exports),,,,,,,,,,,,,,,,,,,,,,,,,,,,,,,,,,,,,,,,,,,,,,,,,,,,,,,,,,
Export unit value index (2000 = 100),,,,,,,,,,,,,,,,,,,,,,,,,,,,,,,,,,,,,,,,,,,,,,,,,,,,,,,,,,
Export volume index (2000 = 100),,,,,,,,,,,,,,,,,,,,,,,,,,,,,,,,,,,,,,,,,,,,,,,,,,,,,,,,,,
Medium and high-tech exports (% manufactured exports),,,,,,,,,,,,,,,,,,,,,,,,,,,,,,,,,,,,,,,,,,,,,,,,,,,,,,,,,,
Net barter terms of trade index (2000 = 100),,,,,,,,,,,,,,,,,,,,,,,,,,,,,,,,,,,,,,,,,,,,,,,,,,,,,,,,,,
Travel services (% of commercial service imports),,,,,,,,,,,,,,,,,,,,,,,,,,,,,,,,,,,,,,,,,,,,,17.4313216786521,18.8714805887999,18.1608222149815,17.9175417695117,19.1554389634368,28.0970486264006,26.4268216785214,37.2114154196942,39.2456715094446,39.8216875409436,36.6245606130914,40.621799285172,45.8780502918011,43.9760375646902
Transport services (% of commercial service imports),,,,,,,,,,,,,,,,,,,,,,,,,,,,,,,,,,,,,,,,,,,,,24.7325987024415,27.8868718360939,24.0792984903686,24.4588140987664,32.9799232081188,23.6111162842848,19.2386770188019,19.2602375077202,20.9251086259396,25.9021053627076,22.1795134054846,30.8412251073079,25.9303038685336,22.9535495486725
Commercial service imports (current US$),,,,,,,,,,,,,,,,,,,,,,,,,,,,,,,,,,,,,,,,,,,,,330471681.677839,338128045.666615,362862535.478921,380021285.484145,402541517.272159,409939704.820572,518095853.972691,592550708.796938,490457159.73306,451304105.541803,591384556.968493,527358571.750946,532042129.615209,586243819.793136
"Computer, communications and other services (% of commercial service imports)",,,,,,,,,,,,,,,,,,,,,,,,,,,,,,,,,,,,,,,,,,,,,50.9674879122716,46.4287802818606,50.7237928954818,48.2283745033767,38.1502187587334,39.3423221411312,46.9728116077189,35.9924075005216,31.6656153816673,24.0207702200209,32.6314013568816,19.8390326139098,18.2611420582216,24.0413998324578
Import value index (2000 = 100),,,,,,,,,,,,,,,,,,,,,,,,,,,,,,,,,,,,,,,,,,,,,,,,,,,,,,,,,,
Merchandise imports from low- and middle-income economies within region (% of total merchandise imports),,,,,,,,,,,,,,,,,,,,,,,,,,,,,,,,,,,,,,,,,,,,,,,,,29.0424849318485,29.4750023695443,29.4457851676297,31.0843986090018,38.8476350739733,38.9338740059022,38.859225080182,38.8934498040525,43.5784795626849,
Merchandise imports by the reporting economy (current US$),,,,,,,,,,,,,,,,,,,,,,,,,,,,,,,,,,,,,,,,,,,,,,,,,2426186780,2341694950,2458776670,3065201193,3202441203,3242694071,3350358527,2906855696,3088371032,
"Merchandise imports by the reporting economy, residual (% of total merchandise imports)",,,,,,,,,,,,,,,,,,,,,,,,,,,,,,,,,,,,,,,,,,,,,,,,,0.004942570827131,0.004912424652067,0.004914435762887,0.004800239551518,0.004259469303362,0.004253531075704,0.004258768094523,0.004256351636934,0.002524081439448,
"Smoking prevalence, females (% of adults)",,,,,,,,,,,,,,,,,,,,,,,,,,,,,,,,,,,,,,,,,,,,,,,,,,,,,,,,,,
"Smoking prevalence, total (ages 15+)",,,,,,,,,,,,,,,,,,,,,,,,,,,,,,,,,,,,,,,,,,,,,,,,,,,,,,,,,,
Prevalence of anemia among pregnant women (%),,,,,,,,,,,,,,,,,,,,,,,,,,,,,,,,,,,,,,,,,,,,,,,,,,,,,,,,,,
Lifetime risk of maternal death (%),,,,,,,,,,,,,,,,,,,,,,,,,,,,,,,,,,,,,,,,,,,,,,,,,,,,,,,,,,
Lifetime risk of maternal death (1 in: rate varies by country),,,,,,,,,,,,,,,,,,,,,,,,,,,,,,,,,,,,,,,,,,,,,,,,,,,,,,,,,,
Number of maternal deaths,,,,,,,,,,,,,,,,,,,,,,,,,,,,,,,,,,,,,,,,,,,,,,,,,,,,,,,,,,
Children with fever receiving antimalarial drugs (% of children under age 5 with fever),,,,,,,,,,,,,,,,,,,,,,,,,,,,,,,,,,,,,,,,,,,,,,,,,,,,,,,,,,
Use of insecticide-treated bed nets (% of under-5 population),,,,,,,,,,,,,,,,,,,,,,,,,,,,,,,,,,,,,,,,,,,,,,,,,,,,,,,,,,
"Incidence of malaria (per 1,000 population at risk)",,,,,,,,,,,,,,,,,,,,,,,,,,,,,,,,,,,,,,,,,,,,,,,,,,,,,,,,,,
"Specialist surgical workforce (per 100,000 population)",,,,,,,,,,,,,,,,,,,,,,,,,,,,,,,,,,,,,,,,,,,,,,,,,,,,,,,27.67,,,
"Physicians (per 1,000 people)",,,,,,,,,,,,,,,,,,,,,,,,,,,,,,,,,,,,,,,,,,,,,,,,,,,,,,,,,,
"Nurses and midwives (per 1,000 people)",,,,,,,,,,,,,,,,,,,,,,,,,,,,,,,,,,,,,,,,,,,,,,,,,,,,,,,,,,
"Community health workers (per 1,000 people)",,,,,,,,,,,,,,,,,,,,,,,,,,,,,,,,,,,,,,,,,,,,,,,,,,,,,,,,,,
"Hospital beds (per 1,000 people)",,,,,,,,,,,,,,,,,,,,,,,,,,,,,,,,,,,,,,,,,,,,,,,,,,,,,,,,,,
"Immunization, measles (% of children ages 12-23 months)",,,,,,,,,,,,,,,,,,,,,,,,,,,,,,,,,,,,,,,,,,,,,,,,,,,,,,,,,,
"Immunization, DPT (% of children ages 12-23 months)",,,,,,,,,,,,,,,,,,,,,,,,,,,,,,,,,,,,,,,,,,,,,,,,,,,,,,,,,,
"Immunization, HepB3 (% of one-year-old children)",,,,,,,,,,,,,,,,,,,,,,,,,,,,,,,,,,,,,,,,,,,,,,,,,,,,,,,,,,
Antiretroviral therapy coverage for PMTCT (% of pregnant women living with HIV),,,,,,,,,,,,,,,,,,,,,,,,,,,,,,,,,,,,,,,,,,,,,,,,,,,,,,,,,,
Incidence of HIV (% of uninfected population ages 15-49),,,,,,,,,,,,,,,,,,,,,,,,,,,,,,,,,,,,,,,,,,,,,,,,,,,,,,,,,,
Adults (ages 15+) and children (ages 0-14) newly infected with HIV,,,,,,,,,,,,,,,,,,,,,,,,,,,,,,,,,,,,,,,,,,,,,,,,,,,,,,,,,,
Children (ages 0-14) newly infected with HIV,,,,,,,,,,,,,,,,,,,,,,,,,,,,,,,,,,,,,,,,,,,,,,,,,,,,,,,,,,
Adults (ages 15+) newly infected with HIV,,,,,,,,,,,,,,,,,,,,,,,,,,,,,,,,,,,,,,,,,,,,,,,,,,,,,,,,,,
Antiretroviral therapy coverage (% of people living with HIV),,,,,,,,,,,,,,,,,,,,,,,,,,,,,,,,,,,,,,,,,,,,,,,,,,,,,,,,,,
"Prevalence of HIV, male (% ages 15-24)",,,,,,,,,,,,,,,,,,,,,,,,,,,,,,,,,,,,,,,,,,,,,,,,,,,,,,,,,,
"Prevalence of HIV, female (% ages 15-24)",,,,,,,,,,,,,,,,,,,,,,,,,,,,,,,,,,,,,,,,,,,,,,,,,,,,,,,,,,
Children (0-14) living with HIV,,,,,,,,,,,,,,,,,,,,,,,,,,,,,,,,,,,,,,,,,,,,,,,,,,,,,,,,,,
People using safely managed drinking water services (% of population),,,,,,,,,,,,,,,,,,,,,,,,,,,,,,,,,,,,,,,,,,,,,,,,,,,,,,,,,,
"People using safely managed drinking water services, urban (% of urban population)",,,,,,,,,,,,,,,,,,,,,,,,,,,,,,,,,,,,,,,,,,,,,,,,,,,,,,,,,,
"People using safely managed drinking water services, rural (% of rural population)",,,,,,,,,,,,,,,,,,,,,,,,,,,,,,,,,,,,,,,,,,,,,,,,,,,,,,,,,,
People using at least basic drinking water services (% of population),,,,,,,,,,,,,,,,,,,,,,,,,,,,,,,,,,,,,,,,,,,,,,,,,,,,,,,,,,
"People using at least basic drinking water services, urban (% of urban population)",,,,,,,,,,,,,,,,,,,,,,,,,,,,,,,,,,,,,,,,,,,,,,,,,,,,,,,,,,
"People using at least basic drinking water services, rural (% of rural population)",,,,,,,,,,,,,,,,,,,,,,,,,,,,,,,,,,,,,,,,,,,,,,,,,,,,,,,,,,
Demand for family planning satisfied by modern methods (% of married women with demand for family planning),,,,,,,,,,,,,,,,,,,,,,,,,,,,,,,,,,,,,,,,,,,,,,,,,,,,,,,,,,
"Mortality rate, neonatal (per 1,000 live births)",,,,,,,,,,,,,,,,,,,,,,,,,,,,,,,,,,,,,,,,,,,,,,,,,,,,,,,,,,
"Mortality from CVD, cancer, diabetes or CRD between exact ages 30 and 70 (%)",,,,,,,,,,,,,,,,,,,,,,,,,,,,,,,,,,,,,,,,,,,,,,,,,,,,,,,,,,
"Mortality rate, under-5, male (per 1,000 live births)",,,,,,,,,,,,,,,,,,,,,,,,,,,,,,,,,,,,,,,,,,,,,,,,,,,,,,,,,,
"Mortality rate, under-5, female (per 1,000 live births)",,,,,,,,,,,,,,,,,,,,,,,,,,,,,,,,,,,,,,,,,,,,,,,,,,,,,,,,,,
"Mortality rate, under-5 (per 1,000 live births)",,,,,,,,,,,,,,,,,,,,,,,,,,,,,,,,,,,,,,,,,,,,,,,,,,,,,,,,,,
"Prevalence of HIV, total (% of population ages 15-49)",,,,,,,,,,,,,,,,,,,,,,,,,,,,,,,,,,,,,,,,,,,,,,,,,,,,,,,,,,
Women's share of population ages 15+ living with HIV (%),,,,,,,,,,,,,,,,,,,,,,,,,,,,,,,,,,,,,,,,,,,,,,,,,,,,,,,,,,
"Probability of dying at age 5-14 years (per 1,000 children age 5)",,,,,,,,,,,,,,,,,,,,,,,,,,,,,,,,,,,,,,,,,,,,,,,,,,,,,,,,,,
Number of neonatal deaths,,,,,,,,,,,,,,,,,,,,,,,,,,,,,,,,,,,,,,,,,,,,,,,,,,,,,,,,,,
"Cause of death, by non-communicable diseases (% of total)",,,,,,,,,,,,,,,,,,,,,,,,,,,,,,,,,,,,,,,,,,,,,,,,,,,,,,,,,,
Number of under-five deaths,,,,,,,,,,,,,,,,,,,,,,,,,,,,,,,,,,,,,,,,,,,,,,,,,,,,,,,,,,
"Cause of death, by injury (% of total)",,,,,,,,,,,,,,,,,,,,,,,,,,,,,,,,,,,,,,,,,,,,,,,,,,,,,,,,,,
Number of infant deaths,,,,,,,,,,,,,,,,,,,,,,,,,,,,,,,,,,,,,,,,,,,,,,,,,,,,,,,,,,
"Cause of death, by communicable diseases and maternal, prenatal and nutrition conditions (% of total)",,,,,,,,,,,,,,,,,,,,,,,,,,,,,,,,,,,,,,,,,,,,,,,,,,,,,,,,,,
Number of deaths ages 5-14 years,,,,,,,,,,,,,,,,,,,,,,,,,,,,,,,,,,,,,,,,,,,,,,,,,,,,,,,,,,
"Condom use, population ages 15-24, male (% of males ages 15-24)",,,,,,,,,,,,,,,,,,,,,,,,,,,,,,,,,,,,,,,,,,,,,,,,,,,,,,,,,,
"Condom use, population ages 15-24, female (% of females ages 15-24)",,,,,,,,,,,,,,,,,,,,,,,,,,,,,,,,,,,,,,,,,,,,,,,,,,,,,,,,,,
Prevalence of anemia among non-pregnant women (% of women ages 15-49),,,,,,,,,,,,,,,,,,,,,,,,,,,,,,,,,,,,,,,,,,,,,,,,,,,,,,,,,,
Prevalence of anemia among children (% of children under 5),,,,,,,,,,,,,,,,,,,,,,,,,,,,,,,,,,,,,,,,,,,,,,,,,,,,,,,,,,
Prevalence of anemia among women of reproductive age (% of women ages 15-49),,,,,,,,,,,,,,,,,,,,,,,,,,,,,,,,,,,,,,,,,,,,,,,,,,,,,,,,,,
"Total alcohol consumption per capita (liters of pure alcohol, projected estimates, 15+ years of age)",,,,,,,,,,,,,,,,,,,,,,,,,,,,,,,,,,,,,,,,,,,,,,,,,,,,,,,,,,
Women who believe a husband is justified in beating his wife when she refuses sex with him (%),,,,,,,,,,,,,,,,,,,,,,,,,,,,,,,,,,,,,,,,,,,,,,,,,,,,,,,,,,
Women who believe a husband is justified in beating his wife (any of five reasons) (%),,,,,,,,,,,,,,,,,,,,,,,,,,,,,,,,,,,,,,,,,,,,,,,,,,,,,,,,,,
Women who believe a husband is justified in beating his wife when she neglects the children (%),,,,,,,,,,,,,,,,,,,,,,,,,,,,,,,,,,,,,,,,,,,,,,,,,,,,,,,,,,
Women who believe a husband is justified in beating his wife when she goes out without telling him (%),,,,,,,,,,,,,,,,,,,,,,,,,,,,,,,,,,,,,,,,,,,,,,,,,,,,,,,,,,
Women who believe a husband is justified in beating his wife when she burns the food (%),,,,,,,,,,,,,,,,,,,,,,,,,,,,,,,,,,,,,,,,,,,,,,,,,,,,,,,,,,
Women who believe a husband is justified in beating his wife when she argues with him (%),,,,,,,,,,,,,,,,,,,,,,,,,,,,,,,,,,,,,,,,,,,,,,,,,,,,,,,,,,
Proportion of women subjected to physical and/or sexual violence in the last 12 months (% of women age 15-49),,,,,,,,,,,,,,,,,,,,,,,,,,,,,,,,,,,,,,,,,,,,,,,,,,,,,,,,,,
"Proportion of time spent on unpaid domestic and care work, male (% of 24 hour day)",,,,,,,,,,,,,,,,,,,,,,,,,,,,,,,,,,,,,,,,,,,,,,,,,,,,,,,,,,
"Proportion of time spent on unpaid domestic and care work, female (% of 24 hour day)",,,,,,,,,,,,,,,,,,,,,,,,,,,,,,,,,,,,,,,,,,,,,,,,,,,,,,,,,,
Nondiscrimination clause mentions gender in the constitution (1=yes; 0=no),,,,,,,,,,,,,,,,,,,,,,,,,,,,,,,,,,,,,,,,,,,,,,,,,,1,,1,,1,,1,,1
Mothers are guaranteed an equivalent position after maternity leave (1=yes; 0=no),,,,,,,,,,,,,,,,,,,,,,,,,,,,,,,,,,,,,,,,,,,,,,,,,,1,,1,,1,,1,,1
Legislation exists on domestic violence (1=yes; 0=no),,,,,,,,,,,,,,,,,,,,,,,,,,,,,,,,,,,,,,,,,,,,,,,,,,,,,,1,,1,,1
Law mandates nondiscrimination based on gender in hiring (1=yes; 0=no),,,,,,,,,,,,,,,,,,,,,,,,,,,,,,,,,,,,,,,,,,,,,,,,,,1,,1,,1,,1,,1
Law mandates paid or unpaid maternity leave (1=yes; 0=no),,,,,,,,,,,,,,,,,,,,,,,,,,,,,,,,,,,,,,,,,,,,,,,,,,1,,1,,1,,1,,1
Law mandates equal remuneration for females and males for work of equal value (1=yes; 0=no),,,,,,,,,,,,,,,,,,,,,,,,,,,,,,,,,,,,,,,,,,,,,,,,,,,,,,1,,1,,1
Law prohibits or invalidates child or early marriage (1=yes; 0=no),,,,,,,,,,,,,,,,,,,,,,,,,,,,,,,,,,,,,,,,,,,,,,,,,,,,,,,,1,,1
Nonpregnant and nonnursing women can do the same jobs as men (1=yes; 0=no),,,,,,,,,,,,,,,,,,,,,,,,,,,,,,,,,,,,,,,,,,,,,,,,,,1,,1,,1,,1,,1
Proportion of seats held by women in national parliaments (%),,,,,,,,,,,,,,,,,,,,,,,,,,,,,,,,,,,,,,,,,,,,,,,,,,,,,,,,,,
"Women making their own informed decisions regarding sexual relations, contraceptive use and reproductive health care  (% of women age 15-49)",,,,,,,,,,,,,,,,,,,,,,,,,,,,,,,,,,,,,,,,,,,,,,,,,,,,,,,,,,
Logistics performance index: Efficiency of customs clearance process (1=low to 5=high),,,,,,,,,,,,,,,,,,,,,,,,,,,,,,,,,,,,,,,,,,,,,,,,,,,,,,,,,,
"Lead time to import, median case (days)",,,,,,,,,,,,,,,,,,,,,,,,,,,,,,,,,,,,,,,,,,,,,,,,,,,,,,,,,,
"Lead time to export, median case (days)",,,,,,,,,,,,,,,,,,,,,,,,,,,,,,,,,,,,,,,,,,,,,,,,,,,,,,,,,,
Individuals using the Internet (% of population),,,,,,,,,,,,,,,,,,,,,,,,,,,,,,,,,,,,,,,,,,,,,,,,,,,,,,,,,,
Secure Internet servers (per 1 million people),,,,,,,,,,,,,,,,,,,,,,,,,,,,,,,,,,,,,,,,,,,,,,,,,,,,,,,,,,
Secure Internet servers,,,,,,,,,,,,,,,,,,,,,,,,,,,,,,,,,,,,,,,,,,,,,,,,,,,,,,,,,,
Fixed broadband subscriptions (per 100 people),,,,,,,,,,,,,,,,,,,,,,,,,,,,,,,,,,,,,,,,,,,,,,,,,,,,,,,,,,
Fixed broadband subscriptions,,,,,,,,,,,,,,,,,,,,,,,,,,,,,,,,,,,,,,,,,,,,,,,,,,,,,,,,,,
Fixed telephone subscriptions (per 100 people),,,,,,,,,,,,,,,,,,,,,,,,,,,,,,,,,,,,,,,,,,,,,,6.10980989467331,6.10980989467331,6.10980989467331,6.10980989467331,6.10980989467331,6.10980989467331,,,,,,,
Fixed telephone subscriptions,,,,,,,,,,,,,,,,,,,,,,,,,,,,,,,,,,,,,,,,,,,,,,106300,106300,106300,106300,106300,106300,,,,,,,
Mobile cellular subscriptions (per 100 people),,,,,,,,,,,,,,,,,,,,,,,,,,,,,,,,,,,,,,,,,,,,,,32.3020993490725,32.3020993490725,32.3020993490725,32.3020993490725,32.3020993490725,32.3020993490725,,,,,,,
Mobile cellular subscriptions,,,,,,,,,,,,,,,,,,,,,,,,,,,,,,,,,,,,,,,,,,,,,,562000,562000,562000,562000,562000,562000,,,,,,,
Container port traffic (TEU: 20 foot equivalent units),,,,,,,,,,,,,,,,,,,,,,,,,,,,,,,,,,,,,,,,,,,,,,,,,,,,,,,,,,
Liner shipping connectivity index (maximum value in 2004 = 100),,,,,,,,,,,,,,,,,,,,,,,,,,,,,,,,,,,,,,,,,,,,,,,,,,,,,,,,,,
Rail lines (total route-km),,,,,,,,,,,,,,,,,,,,,,,,,,,,,,,,,,,,,,,,,,,,,,,,,,,,,,,,,,
"Railways, passengers carried (million passenger-km)",,,,,,,,,,,,,,,,,,,,,,,,,,,,,,,,,,,,,,,,,,,,,,,,,,,,,,,,,,
"Railways, goods transported (million ton-km)",,,,,,,,,,,,,,,,,,,,,,,,,,,,,,,,,,,,,,,,,,,,,,,,,,,,,,,,,,
"Air transport, passengers carried",,,,,,,,,,,,,,,,,,,,,,,,,,,,,,,,,,,,,,,,,,,,,,,,,,,,,,,,,,
"Air transport, freight (million ton-km)",,,,,,,,,,,,,,,,,,,,,,,,,,,,,,,,,,,,,,,,,,,,,,,,,,,,,,,,,,
"Air transport, registered carrier departures worldwide",,,,,,,,,,,,,,,,,,,,,,,,,,,,,,,,,,,,,,,,,,,,,,,,,,,,,,,,,,
"Quality of port infrastructure, WEF (1=extremely underdeveloped to 7=well developed and efficient by international standards)",,,,,,,,,,,,,,,,,,,,,,,,,,,,,,,,,,,,,,,,,,,,,,,,,,,,,,,,,,
"Burden of customs procedure, WEF (1=extremely inefficient to 7=extremely efficient)",,,,,,,,,,,,,,,,,,,,,,,,,,,,,,,,,,,,,,,,,,,,,,,,,,,,,,,,,,
Source data assessment of statistical capacity (scale 0 - 100),,,,,,,,,,,,,,,,,,,,,,,,,,,,,,,,,,,,,,,,,,,,,,,,,,,,,,40,40,60,60,60
Periodicity and timeliness assessment of statistical capacity (scale 0 - 100),,,,,,,,,,,,,,,,,,,,,,,,,,,,,,,,,,,,,,,,,,,,,,,,,,,,,,10,10,10,20,20
Statistical Capacity score (Overall average),,,,,,,,,,,,,,,,,,,,,,,,,,,,,,,,,,,,,,,,,,,,,,,,,,,,,,30,33.3333333333333,40,43.3333333333333,43.3333333333333
Methodology assessment of statistical capacity (scale 0 - 100),,,,,,,,,,,,,,,,,,,,,,,,,,,,,,,,,,,,,,,,,,,,,,,,,,,,,,40,50,50,50,50
"CPIA transparency, accountability, and corruption in the public sector rating (1=low to 6=high)",,,,,,,,,,,,,,,,,,,,,,,,,,,,,,,,,,,,,,,,,,,,,,,,,,3,3,3,3,3,3,3,3,3
CPIA trade rating (1=low to 6=high),,,,,,,,,,,,,,,,,,,,,,,,,,,,,,,,,,,,,,,,,,,,,,,,,,5,5,4.5,4.5,4.5,4.5,4.5,5,5
CPIA structural policies cluster average (1=low to 6=high),,,,,,,,,,,,,,,,,,,,,,,,,,,,,,,,,,,,,,,,,,,,,,,,,,4,4,3.83333333333333,3.83333333333333,3.83333333333333,3.83333,3.83333,4.16667,4.16666666666667
CPIA policies for social inclusion/equity cluster average (1=low to 6=high),,,,,,,,,,,,,,,,,,,,,,,,,,,,,,,,,,,,,,,,,,,,,,,,,,3.2,3.2,3.1,3.3,3.3,3.3,3.3,3.3,3.3
CPIA efficiency of revenue mobilization rating (1=low to 6=high),,,,,,,,,,,,,,,,,,,,,,,,,,,,,,,,,,,,,,,,,,,,,,,,,,3.5,3.5,3.5,4,4,4,3.5,3.5,3.5
CPIA public sector management and institutions cluster average (1=low to 6=high),,,,,,,,,,,,,,,,,,,,,,,,,,,,,,,,,,,,,,,,,,,,,,,,,,3.2,3.2,3.3,3.4,3.4,3.4,3.3,3.3,3.3
CPIA social protection rating (1=low to 6=high),,,,,,,,,,,,,,,,,,,,,,,,,,,,,,,,,,,,,,,,,,,,,,,,,,3.5,3.5,3.5,3.5,3.5,3.5,3.5,3.5,3.5
CPIA property rights and rule-based governance rating (1=low to 6=high),,,,,,,,,,,,,,,,,,,,,,,,,,,,,,,,,,,,,,,,,,,,,,,,,,3,3,3,3,3,3,3,3,3
CPIA equity of public resource use rating (1=low to 6=high),,,,,,,,,,,,,,,,,,,,,,,,,,,,,,,,,,,,,,,,,,,,,,,,,,3.5,3.5,3,3,3,3,3,3,3
CPIA quality of public administration rating (1=low to 6=high),,,,,,,,,,,,,,,,,,,,,,,,,,,,,,,,,,,,,,,,,,,,,,,,,,2.5,2.5,3,3,3,3,3,3,3
CPIA macroeconomic management rating (1=low to 6=high),,,,,,,,,,,,,,,,,,,,,,,,,,,,,,,,,,,,,,,,,,,,,,,,,,3.5,3.5,3.5,3.5,3.5,3.5,3.5,3.5,3.5
IDA resource allocation index (1=low to 6=high),,,,,,,,,,,,,,,,,,,,,,,,,,,,,,,,,,,,,,,,,,,,,,,,,,3.43333333333333,3.43333333333333,3.43333333333333,3.50833333333333,3.59166666666667,3.55,3.525,3.56667,3.56666666666667
CPIA building human resources rating (1=low to 6=high),,,,,,,,,,,,,,,,,,,,,,,,,,,,,,,,,,,,,,,,,,,,,,,,,,2.5,2.5,3,3.5,3.5,3.5,3.5,3.5,3.5
CPIA gender equality rating (1=low to 6=high),,,,,,,,,,,,,,,,,,,,,,,,,,,,,,,,,,,,,,,,,,,,,,,,,,3.5,3.5,3.5,3.5,3.5,3.5,3.5,3.5,3.5
CPIA fiscal policy rating (1=low to 6=high),,,,,,,,,,,,,,,,,,,,,,,,,,,,,,,,,,,,,,,,,,,,,,,,,,3,3,3,3,3.5,3,3,2.5,2.5
CPIA financial sector rating (1=low to 6=high),,,,,,,,,,,,,,,,,,,,,,,,,,,,,,,,,,,,,,,,,,,,,,,,,,3.5,3.5,3.5,3.5,3.5,3.5,3.5,3.5,3.5
CPIA quality of budgetary and financial management rating (1=low to 6=high),,,,,,,,,,,,,,,,,,,,,,,,,,,,,,,,,,,,,,,,,,,,,,,,,,4,4,4,4,4,4,4,4,4
CPIA policy and institutions for environmental sustainability rating (1=low to 6=high),,,,,,,,,,,,,,,,,,,,,,,,,,,,,,,,,,,,,,,,,,,,,,,,,,3,3,2.5,3,3,3,3,3,3
CPIA economic management cluster average (1=low to 6=high),,,,,,,,,,,,,,,,,,,,,,,,,,,,,,,,,,,,,,,,,,,,,,,,,,3.33333333333333,3.33333333333333,3.5,3.5,3.83333333333333,3.66667,3.66667,3.5,3.5
CPIA debt policy rating (1=low to 6=high),,,,,,,,,,,,,,,,,,,,,,,,,,,,,,,,,,,,,,,,,,,,,,,,,,3.5,3.5,4,4,4.5,4.5,4.5,4.5,4.5
CPIA business regulatory environment rating (1=low to 6=high),,,,,,,,,,,,,,,,,,,,,,,,,,,,,,,,,,,,,,,,,,,,,,,,,,3.5,3.5,3.5,3.5,3.5,3.5,3.5,4,4
"Trademark applications, total",,,,,,,,,,,,,,,,,,,,,,,,,,,,,,,,,,,,,,,,,,,,,,,,,,,,,,,,,,
"Trademark applications, resident, by count",,,,,,,,,,,,,,,,,,,,,,,,,,,,,,,,,,,,,,,,,,,,,,,,,,,,,,,,,,
"Trademark applications, direct resident",,,,,,,,,,,,,,,,,,,,,,,,,,,,,,,,,,,,,,,,,,,,,,,,,,,,,,,,,,
"Trademark applications, direct nonresident",,,,,,,,,,,,,,,,,,,,,,,,,,,,,,,,,,,,,,,,,,,,,,,,,,,,,,,,,,
