"PPG, multilateral (DIS, current US$)",,,,,,,,,,,0,0,0,0,0,0,0,0,0,0,0,0,0,0,0,0,0,0,0,0,0,0,0,0,0,0,0,0,0,0,0,0,0,0,0,0,0,0,0,0,0,6531000,4535000,5855000,9630000,7263000,39781000,24310000
"PPG, IDA (DIS, current US$)",,,,,,,,,,,0,0,0,0,0,0,0,0,0,0,0,0,0,0,0,0,0,0,0,0,0,0,0,0,0,0,0,0,0,0,0,0,0,0,0,0,0,0,0,0,0,6531000,4535000,5855000,9630000,7263000,7693000,
"PPG, IBRD (DIS, current US$)",,,,,,,,,,,0,0,0,0,0,0,0,0,0,0,0,0,0,0,0,0,0,0,0,0,0,0,0,0,0,0,0,0,0,0,0,0,0,0,0,0,0,0,0,0,0,0,0,0,0,0,0,
IDA grants (current US$),,,,,,,,,,,0,0,0,0,0,0,0,0,0,0,0,0,0,0,0,0,0,0,0,0,0,0,0,0,0,0,0,0,0,0,0,0,0,116770,8090015.4,4478342,3614145.01,5934839.71,7891883.95,6502353.31,8272267.84,8007134.79,9444700.37,4450986.72,3522842.18,760750.36,1756382.8,1036819.4
"Disbursements on external debt, public and publicly guaranteed (PPG) (DIS, current US$)",,,,,,,,,,,0,0,0,0,0,0,0,0,0,0,0,0,0,0,0,0,0,0,0,0,0,0,0,0,0,0,0,0,0,0,0,0,0,0,0,0,0,0,0,0,0,6531000,4713000,8347000,21809000,33270000,68556000,
"Disbursements on external debt, private nonguaranteed (PNG) (DIS, current US$)",,,,,,,,,,,0,0,0,0,0,0,0,0,0,0,0,0,0,0,0,0,0,0,0,0,0,0,0,0,0,0,0,0,0,0,0,0,0,0,0,0,0,306582000,160559000,90137000,169490000,151837000,104505000,136270000,53811000,78000000,106618000,
"Disbursements on external debt, long-term (DIS, current US$)",,,,,,,,,,,0,0,0,0,0,0,0,0,0,0,0,0,0,0,0,0,0,0,0,0,0,0,0,0,0,0,0,0,0,0,0,0,0,0,0,0,0,306582000,160559000,90137000,169490000,158368000,109218000,144617000,75620000,111270000,175174000,35941000
"Disbursements on external debt, long-term + IMF (DIS, current US$)",,,,,,,,,,,0,0,0,0,0,0,0,0,0,0,0,0,0,0,0,0,0,0,0,0,0,0,0,0,0,0,0,0,0,0,0,0,0,0,0,0,0,306582000,160559000,90137000,198116000,158368000,228699000,144617000,75620000,150585000,214235000,
"IMF purchases (DIS, current US$)",,,,,,,,,,,0,0,0,0,0,0,0,0,0,0,0,0,0,0,0,0,0,0,0,0,0,0,0,0,0,0,0,0,0,0,0,0,0,0,0,0,0,0,0,0,28626000,0,119481000,0,0,39315000,39061000,
"PPG, bilateral concessional (DIS, current US$)",,,,,,,,,,,0,0,0,0,0,0,0,0,0,0,0,0,0,0,0,0,0,0,0,0,0,0,0,0,0,0,0,0,0,0,0,0,0,0,0,0,0,0,0,0,0,0,178000,1074000,4529000,8444000,22512000,
"PPG, bilateral (DIS, current US$)",,,,,,,,,,,0,0,0,0,0,0,0,0,0,0,0,0,0,0,0,0,0,0,0,0,0,0,0,0,0,0,0,0,0,0,0,0,0,0,0,0,0,0,0,0,0,0,178000,2492000,9605000,8444000,22512000,11054000
Debt forgiveness or reduction (current US$),,,,,,,,,,,0,0,0,0,0,0,0,0,0,0,0,0,0,0,0,0,0,0,0,0,0,0,0,0,0,0,0,0,0,0,0,0,0,0,0,0,0,0,0,0,0,0,0,0,0,0,0,
"Currency composition of PPG debt, U.S. dollars (%)",,,,,,,,,,,0,0,0,0,0,0,0,0,0,0,0,0,0,0,0,0,0,0,0,0,0,0,0,0,0,0,0,0,0,0,0,0,0,0,0,0,0,0,0,100,100,100,98.418,95.6098,87.9188,76.6219,60.6816,
"Currency composition of PPG debt, Pound sterling (%)",,,,,,,,,,,0,0,0,0,0,0,0,0,0,0,0,0,0,0,0,0,0,0,0,0,0,0,0,0,0,0,0,0,0,0,0,0,0,0,0,0,0,0,0,0,0,0,0,0,0,0,0,
"Currency composition of PPG debt, Swiss franc (%)",,,,,,,,,,,0,0,0,0,0,0,0,0,0,0,0,0,0,0,0,0,0,0,0,0,0,0,0,0,0,0,0,0,0,0,0,0,0,0,0,0,0,0,0,0,0,0,0,0,0,0,0,
"Currency composition of PPG debt, SDR (%)",,,,,,,,,,,0,0,0,0,0,0,0,0,0,0,0,0,0,0,0,0,0,0,0,0,0,0,0,0,0,0,0,0,0,0,0,0,0,0,0,0,0,0,0,0,0,0,0,0,0,0,0.0173,
"Currency composition of PPG debt, all other currencies (%)",,,,,,,,,,,100,100,100,100,100,100,100,100,100,100,100,100,100,100,100,100,100,100,100,100,100,100,100,100,100,100,100,100,100,100,100,100,100,100,100,100,100,100,100,0,0,0,9.99999999891088E-05,9.99999999891088E-05,0.000100000000003,0.000100000000003,0.000200000000007,
"Currency composition of PPG debt, Multiple currencies (%)",,,,,,,,,,,0,0,0,0,0,0,0,0,0,0,0,0,0,0,0,0,0,0,0,0,0,0,0,0,0,0,0,0,0,0,0,0,0,0,0,0,0,0,0,0,0,0,0,0,0,0,0,
"Currency composition of PPG debt, Japanese yen (%)",,,,,,,,,,,0,0,0,0,0,0,0,0,0,0,0,0,0,0,0,0,0,0,0,0,0,0,0,0,0,0,0,0,0,0,0,0,0,0,0,0,0,0,0,0,0,0,0,0,0,0,0,
"Currency composition of PPG debt, French franc (%)",,,,,,,,,,,0,0,0,0,0,0,0,0,0,0,0,0,0,0,0,0,0,0,0,0,0,0,0,0,0,0,0,0,0,0,0,0,0,0,0,0,0,0,0,0,0,0,0,0,0,0,0,
"Currency composition of PPG debt, Euro (%)",,,,,,,,,,,0,0,0,0,0,0,0,0,0,0,0,0,0,0,0,0,0,0,0,0,0,0,0,0,0,0,0,0,0,0,0,0,0,0,0,0,0,0,0,0,0,0,1.5819,4.3901,12.0811,23.378,39.3009,
"Currency composition of PPG debt, Deutsche mark (%)",,,,,,,,,,,0,0,0,0,0,0,0,0,0,0,0,0,0,0,0,0,0,0,0,0,0,0,0,0,0,0,0,0,0,0,0,0,0,0,0,0,0,0,0,0,0,0,0,0,0,0,0,
"Commitments, private creditors (COM, current US$)",,,,,,,,,,,0,0,0,0,0,0,0,0,0,0,0,0,0,0,0,0,0,0,0,0,0,0,0,0,0,0,0,0,0,0,0,0,0,0,0,0,0,0,0,0,22557000,0,0,0,0,2884000,0,
"Commitments, official creditors (COM, current US$)",,,,,,,,,,,0,0,0,0,0,0,0,0,0,0,0,0,0,0,0,0,0,0,0,0,0,0,0,0,0,0,0,0,0,0,0,0,0,0,0,0,0,0,0,0,19101000,40199000,25487000,101385000,0,172368000,65282000,
"Commitments, IDA (COM, current US$)",,,,,,,,,,,0,0,0,0,0,0,0,0,0,0,0,0,0,0,0,0,0,0,0,0,0,0,0,0,0,0,0,0,0,0,0,0,0,0,0,0,0,0,0,0,11140000,33300000,0,4312000,0,49360000,0,
"Commitments, IBRD (COM, current US$)",,,,,,,,,,,0,0,0,0,0,0,0,0,0,0,0,0,0,0,0,0,0,0,0,0,0,0,0,0,0,0,0,0,0,0,0,0,0,0,0,0,0,0,0,0,0,0,0,0,0,0,0,
"Commitments, public and publicly guaranteed (COM, current US$)",,,,,,,,,,,0,0,0,0,0,0,0,0,0,0,0,0,0,0,0,0,0,0,0,0,0,0,0,0,0,0,0,0,0,0,0,0,0,0,0,0,0,0,0,0,41658000,40199000,25487000,101385000,0,175252000,65282000,
"Principal rescheduled, private (current US$)",,,,,,,,,,,0,0,0,0,0,0,0,0,0,0,0,0,0,0,0,0,0,0,0,0,0,0,0,0,0,0,0,0,0,0,0,0,0,0,0,0,0,0,0,0,0,0,0,0,0,0,0,
"Principal rescheduled, official (current US$)",,,,,,,,,,,0,0,0,0,0,0,0,0,0,0,0,0,0,0,0,0,0,0,0,0,0,0,0,0,0,0,0,0,0,0,0,0,0,0,0,0,0,0,0,0,0,0,0,0,0,0,0,
Principal rescheduled (current US$),,,,,,,,,,,0,0,0,0,0,0,0,0,0,0,0,0,0,0,0,0,0,0,0,0,0,0,0,0,0,0,0,0,0,0,0,0,0,0,0,0,0,0,0,0,0,0,0,0,0,0,0,
Principal forgiven (current US$),,,,,,,,,,,0,0,0,0,0,0,0,0,0,0,0,0,0,0,0,0,0,0,0,0,0,0,0,0,0,0,0,0,0,0,0,0,0,0,0,0,0,0,0,0,0,0,0,0,0,0,0,
"Principal arrears, private creditors (current US$)",,,,,,,,,,,0,0,0,0,0,0,0,0,0,0,0,0,0,0,0,0,0,0,0,0,0,0,0,0,0,0,0,0,0,0,0,0,0,0,0,0,0,0,0,0,0,0,0,0,0,0,0,
"Principal arrears, official creditors (current US$)",,,,,,,,,,,0,0,0,0,0,0,0,0,0,0,0,0,0,0,0,0,0,0,0,0,0,0,0,0,0,0,0,0,0,0,0,0,0,0,0,0,0,0,0,0,0,0,0,0,0,0,0,
"Principal arrears, long-term DOD (US$)",,,,,,,,,,,0,0,0,0,0,0,0,0,0,0,0,0,0,0,0,0,0,0,0,0,0,0,0,0,0,0,0,0,0,0,0,0,0,0,0,0,0,0,0,0,0,0,0,0,0,0,0,
"PPG, private creditors (AMT, current US$)",,,,,,,,,,,0,0,0,0,0,0,0,0,0,0,0,0,0,0,0,0,0,0,0,0,0,0,0,0,0,0,0,0,0,0,0,0,0,0,0,0,0,0,0,0,0,0,0,0,0,0,2213000,2108000
"PPG, other private creditors (AMT, current US$)",,,,,,,,,,,0,0,0,0,0,0,0,0,0,0,0,0,0,0,0,0,0,0,0,0,0,0,0,0,0,0,0,0,0,0,0,0,0,0,0,0,0,0,0,0,0,0,0,0,0,0,0,
"PNG, commercial banks and other creditors (AMT, current US$)",,,,,,,,,,,0,0,0,0,0,0,0,0,0,0,0,0,0,0,0,0,0,0,0,0,0,0,0,0,0,0,0,0,0,0,0,0,0,0,0,0,0,0,36790000,61232000,61305000,68286000,79099000,85723000,78110000,65164000,72830000,
"PNG, bonds (AMT, current US$)",,,,,,,,,,,0,0,0,0,0,0,0,0,0,0,0,0,0,0,0,0,0,0,0,0,0,0,0,0,0,0,0,0,0,0,0,0,0,0,0,0,0,0,0,0,0,0,0,0,0,0,0,
"PPG, commercial banks (AMT, current US$)",,,,,,,,,,,0,0,0,0,0,0,0,0,0,0,0,0,0,0,0,0,0,0,0,0,0,0,0,0,0,0,0,0,0,0,0,0,0,0,0,0,0,0,0,0,0,0,0,0,0,0,2213000,2108000
"PPG, bonds (AMT, current US$)",,,,,,,,,,,0,0,0,0,0,0,0,0,0,0,0,0,0,0,0,0,0,0,0,0,0,0,0,0,0,0,0,0,0,0,0,0,0,0,0,0,0,0,0,0,0,0,0,0,0,0,0,
"PPG, official creditors (AMT, current US$)",,,,,,,,,,,0,0,0,0,0,0,0,0,0,0,0,0,0,0,0,0,0,0,0,0,0,0,0,0,0,0,0,0,0,0,0,0,0,0,0,0,0,0,0,207736000,14270000,16599000,14817000,14935000,15199000,13880000,16467000,19350000
"PPG, multilateral concessional (AMT, current US$)",,,,,,,,,,,0,0,0,0,0,0,0,0,0,0,0,0,0,0,0,0,0,0,0,0,0,0,0,0,0,0,0,0,0,0,0,0,0,0,0,0,0,0,0,0,0,0,0,0,0,0,0,
"PPG, multilateral (AMT, current US$)",,,,,,,,,,,0,0,0,0,0,0,0,0,0,0,0,0,0,0,0,0,0,0,0,0,0,0,0,0,0,0,0,0,0,0,0,0,0,0,0,0,0,0,0,207736000,14270000,16599000,14817000,14935000,15199000,12407000,12654000,15990000
"PPG, IDA (AMT, current US$)",,,,,,,,,,,0,0,0,0,0,0,0,0,0,0,0,0,0,0,0,0,0,0,0,0,0,0,0,0,0,0,0,0,0,0,0,0,0,0,0,0,0,0,0,0,0,0,0,0,0,0,0,
"PPG, IBRD (AMT, current US$)",,,,,,,,,,,0,0,0,0,0,0,0,0,0,0,0,0,0,0,0,0,0,0,0,0,0,0,0,0,0,0,0,0,0,0,0,0,0,0,0,0,0,0,0,207736000,14270000,16599000,14817000,14935000,15199000,12407000,12654000,
"Principal repayments on external debt, public and publicly guaranteed (PPG) (AMT, current US$)",,,,,,,,,,,0,0,0,0,0,0,0,0,0,0,0,0,0,0,0,0,0,0,0,0,0,0,0,0,0,0,0,0,0,0,0,0,0,0,0,0,0,0,0,207736000,14270000,16599000,14817000,14935000,15199000,13880000,18680000,
"Principal repayments on external debt, private nonguaranteed (PNG) (AMT, current US$)",,,,,,,,,,,0,0,0,0,0,0,0,0,0,0,0,0,0,0,0,0,0,0,0,0,0,0,0,0,0,0,0,0,0,0,0,0,0,0,0,0,0,0,36790000,61232000,61305000,68286000,79099000,85723000,78110000,65164000,72830000,278640000
"Principal repayments on external debt, long-term (AMT, current US$)",,,,,,,,,,,0,0,0,0,0,0,0,0,0,0,0,0,0,0,0,0,0,0,0,0,0,0,0,0,0,0,0,0,0,0,0,0,0,0,0,0,0,0,36790000,268968000,75575000,84885000,93916000,100658000,93309000,79044000,91510000,300098000
"Principal repayments on external debt, long-term + IMF (AMT, current US$)",,,,,,,,,,,0,0,0,0,0,0,0,0,0,0,0,0,0,0,0,0,0,0,0,0,0,0,0,0,0,0,0,0,0,0,0,0,0,0,0,0,0,0,36790000,268968000,75575000,84885000,93916000,104235000,107560000,97213000,145872000,
"IMF repurchases (AMT, current US$)",,,,,,,,,,,0,0,0,0,0,0,0,0,0,0,0,0,0,0,0,0,0,0,0,0,0,0,0,0,0,0,0,0,0,0,0,0,0,0,0,0,0,0,0,0,0,0,0,3577000,14251000,18169000,54362000,
"Children in employment, wage workers, female (% of female children in employment, ages 7-14)",,,,,,,,,,,,,,,,,,,,,,,,,,,,,,,,,,,,,,,,,,,,,,,,,,,,,,,,,,
"Unemployment, total (% of total labor force) (modeled ILO estimate)",,,,,,,,,,,,,,,,,,,,,,,,,,,,,,,,,,,,,,,,,,,,,,,,,,,,,,,,,,
"Unemployment, total (% of total labor force) (national estimate)",,,,,,,,,,,,,,,,,,,,,,,,,,,,,,,,,,,,,,,,,,57,55,49.7000007629395,39.7000007629395,41.4000015258789,44.9000015258789,46.2999992370605,47.5,45.4000015258789,,,30.9500007629395,,35.1500015258789,32.9300003051758,27.4699993133545,
"Unemployment, male (% of male labor force) (modeled ILO estimate)",,,,,,,,,,,,,,,,,,,,,,,,,,,,,,,,,,,,,,,,,,,,,,,,,,,,,,,,,,
"Unemployment, male (% of male labor force) (national estimate)",,,,,,,,,,,,,,,,,,,,,,,,,,,,,,,,,,,,,,,,,,52,45.2000007629395,40.2999992370605,31.5,32.9000015258789,34.5999984741211,38.5,42.7000007629395,40.7000007629395,,,28.1000003814697,,32.9500007629395,31.7900009155273,26.1499996185303,
"Unemployment, female (% of female labor force) (modeled ILO estimate)",,,,,,,,,,,,,,,,,,,,,,,,,,,,,,,,,,,,,,,,,,,,,,,,,,,,,,,,,,
"Unemployment, female (% of female labor force) (national estimate)",,,,,,,,,,,,,,,,,,,,,,,,,,,,,,,,,,,,,,,,,,70,74.5,71.9000015258789,60.7000007629395,60.5,61.5999984741211,55.2000007629395,59.5999984741211,56.4000015258789,,,39.9799995422363,,41.5299987792969,36.5699996948242,31.6900005340576,
"Share of youth not in education, employment or training, total (% of youth population)",,,,,,,,,,,,,,,,,,,,,,,,,,,,,,,,,,,,,,,,,,,,,,,,,,,,,,,30.1800003051758,31.4300003051758,30.1000003814697,
"Share of youth not in education, employment or training, male (% of male youth population)",,,,,,,,,,,,,,,,,,,,,,,,,,,,,,,,,,,,,,,,,,,,,,,,,,,,,,,26.6200008392334,28.2700004577637,26.4799995422363,
"Share of youth not in education, employment or training, female (% of female youth population)",,,,,,,,,,,,,,,,,,,,,,,,,,,,,,,,,,,,,,,,,,,,,,,,,,,,,,,34.0499992370605,34.9500007629395,34.1699981689453,
Unemployment with intermediate education (% of total labor force with intermediate education),,,,,,,,,,,,,,,,,,,,,,,,,,,,,,,,,,,,,,,,,,,,,,,,,,,,,,,45.1800003051758,41.060001373291,36.6599998474121,
"Unemployment with intermediate education, male (% of male labor force with intermediate education)",,,,,,,,,,,,,,,,,,,,,,,,,,,,,,,,,,,,,,,,,,,,,,,,,,,,,,,35.2099990844727,32.7099990844727,19.5799999237061,
"Unemployment with intermediate education, female (% of female labor force with intermediate education)",,,,,,,,,,,,,,,,,,,,,,,,,,,,,,,,,,,,,,,,,,,,,,,,,,,,,,,32.3699989318848,30.6800003051758,14.8900003433228,
Unemployment with basic education (% of total labor force with basic education),,,,,,,,,,,,,,,,,,,,,,,,,,,,,,,,,,,,,,,,,,,,,,,,,,,,,,,48.9700012207031,39.4599990844727,47.5699996948242,
"Unemployment with basic education, male (% of male labor force with basic education)",,,,,,,,,,,,,,,,,,,,,,,,,,,,,,,,,,,,,,,,,,,,,,,,,,,,,,,45.6500015258789,46.6699981689453,54.8899993896484,
"Unemployment with basic education, female (% of female labor force with basic education)",,,,,,,,,,,,,,,,,,,,,,,,,,,,,,,,,,,,,,,,,,,,,,,,,,,,,,,44.5999984741211,48.5699996948242,56.7400016784668,
Unemployment with advanced education (% of total labor force with advanced education),,,,,,,,,,,,,,,,,,,,,,,,,,,,,,,,,,,,,,,,,,,,,,,,,,,,,,,27.0599994659424,27.9599990844727,8.1899995803833,
"Unemployment with advanced education, male (% of male labor force with advanced education)",,,,,,,,,,,,,,,,,,,,,,,,,,,,,,,,,,,,,,,,,,,,,,,,,,,,,,,20.1100006103516,19.9400005340576,4.57000017166138,
"Unemployment with advanced education, female (% of female labor force with advanced education)",,,,,,,,,,,,,,,,,,,,,,,,,,,,,,,,,,,,,,,,,,,,,,,,,,,,,,,15.5200004577637,14.6800003051758,2.5,
"Unemployment, youth total (% of total labor force ages 15-24) (modeled ILO estimate)",,,,,,,,,,,,,,,,,,,,,,,,,,,,,,,,,,,,,,,,,,,,,,,,,,,,,,,,,,
"Unemployment, youth total (% of total labor force ages 15-24) (national estimate)",,,,,,,,,,,,,,,,,,,,,,,,,,,,,,,,,,,,,,,,,,,,,,,,,,,,,55.3400001525879,,61,57.7099990844727,52.3600006103516,
"Unemployment, youth male (% of male labor force ages 15-24) (modeled ILO estimate)",,,,,,,,,,,,,,,,,,,,,,,,,,,,,,,,,,,,,,,,,,,,,,,,,,,,,,,,,,
"Unemployment, youth male (% of male labor force ages 15-24) (national estimate)",,,,,,,,,,,,,,,,,,,,,,,,,,,,,,,,,,,,,,,,,,,,,,,,,,,,,52.0200004577637,,56.2299995422363,54.2400016784668,47.25,
"Unemployment, youth female (% of female labor force ages 15-24) (modeled ILO estimate)",,,,,,,,,,,,,,,,,,,,,,,,,,,,,,,,,,,,,,,,,,,,,,,,,,,,,,,,,,
"Unemployment, youth female (% of female labor force ages 15-24) (national estimate)",,,,,,,,,,,,,,,,,,,,,,,,,,,,,,,,,,,,,,,,,,,,,,,,,,,,,63.7599983215332,,71.7399978637695,67.2300033569336,65.3600006103516,
"Labor force, total",,,,,,,,,,,,,,,,,,,,,,,,,,,,,,,,,,,,,,,,,,,,,,,,,,,,,,,,,,
"Labor force, female (% of total labor force)",,,,,,,,,,,,,,,,,,,,,,,,,,,,,,,,,,,,,,,,,,,,,,,,,,,,,,,,,,
"Part time employment, total (% of total employment)",,,,,,,,,,,,,,,,,,,,,,,,,,,,,,,,,,,,,,,,,,,,,,,,,,,,,,,13.0100002288818,11.2799997329712,7.76999998092651,
"Part time employment, male (% of total male employment)",,,,,,,,,,,,,,,,,,,,,,,,,,,,,,,,,,,,,,,,,,,,,,,,,,,,,,,11.1000003814697,9.02999973297119,5.28000020980835,
"Part time employment, female (% of total female employment)",,,,,,,,,,,,,,,,,,,,,,,,,,,,,,,,,,,,,,,,,,,,,,,,,,,,,,,19.2999992370605,19.0300006866455,16.4500007629395,
Labor force with intermediate education (% of total working-age population with intermediate education),,,,,,,,,,,,,,,,,,,,,,,,,,,,,,,,,,,,,,,,,,,,,,,,,,,,,,,32,23.9200000762939,22.8500003814697,
"Labor force with intermediate education, male (% of male working-age population with intermediate education)",,,,,,,,,,,,,,,,,,,,,,,,,,,,,,,,,,,,,,,,,,,,,,,,,,,,,,,52.9900016784668,45.6199989318848,40.5,
"Labor force with intermediate education, female (% of female working-age population with intermediate education)",,,,,,,,,,,,,,,,,,,,,,,,,,,,,,,,,,,,,,,,,,,,,,,,,,,,,,,65.1500015258789,58.5299987792969,51.3899993896484,
"Labor force participation rate, total (% of total population ages 15+) (modeled ILO estimate)",,,,,,,,,,,,,,,,,,,,,,,,,,,,,,,,,,,,,,,,,,,,,,,,,,,,,,,,,,
"Labor force participation rate, total (% of total population ages 15+) (national estimate)",,,,,,,,,,,,,,,,,,,,,,,,,,,,,,,,,,,,,,,,,,,52.7999992370605,50.2999992370605,49.5,48.7000007629395,52.5,46.5,46,48.0999984741211,,,36.9000015258789,40.5099983215332,37.1800003051758,33.3199996948242,34.1100006103516,
"Labor force participation rate, male (% of male population ages 15+) (modeled ILO estimate)",,,,,,,,,,,,,,,,,,,,,,,,,,,,,,,,,,,,,,,,,,,,,,,,,,,,,,,,,,
"Labor force participation rate, male (% of male population ages 15+) (national estimate)",,,,,,,,,,,,,,,,,,,,,,,,,,,,,,,,,,,,,,,,,,,71.9000015258789,71.6999969482422,67.8000030517578,68.3000030517578,69.5999984741211,65.1999969482422,65.8000030517578,67.5,,,55.4000015258789,60.1599998474121,55.5200004577637,50.5400009155273,51.8199996948242,
Ratio of female to male labor force participation rate (%) (modeled ILO estimate),,,,,,,,,,,,,,,,,,,,,,,,,,,,,,,,,,,,,,,,,,,,,,,,,,,,,,,,,,
Ratio of female to male labor force participation rate (%) (national estimate),,,,,,,,,,,,,,,,,,,,,,,,,,,,,,,,,,,,,,,,,,,47.9833091346771,41.1436558655575,37.1681410452181,43.4846258212211,43.9655187533481,43.4049088369221,39.6656522355168,42.6666655363859,,,32.1299616368162,34.9734058658452,34.2759375535711,31.5789468718503,31.4164430384425,
"Labor force participation rate, female (% of female population ages 15+) (modeled ILO estimate)",,,,,,,,,,,,,,,,,,,,,,,,,,,,,,,,,,,,,,,,,,,,,,,,,,,,,,,,,,
"Labor force participation rate, female (% of female population ages 15+) (national estimate)",,,,,,,,,,,,,,,,,,,,,,,,,,,,,,,,,,,,,,,,,,,34.5,29.5,25.2000007629395,29.7000007629395,30.6000003814697,28.2999992370605,26.1000003814697,28.7999992370605,,,17.7999992370605,21.0400009155273,19.0300006866455,15.960000038147,16.2800006866455,
Labor force with basic education (% of total working-age population with basic education),,,,,,,,,,,,,,,,,,,,,,,,,,,,,,,,,,,,,,,,,,,,,,,,,,,,,,,7.19999980926514,5.23999977111816,8.27000045776367,
"Labor force with basic education, male (% of male working-age population with basic education)",,,,,,,,,,,,,,,,,,,,,,,,,,,,,,,,,,,,,,,,,,,,,,,,,,,,,,,18.5900001525879,15.6300001144409,25.2299995422363,
"Labor force with basic education, female (% of female working-age population with basic education)",,,,,,,,,,,,,,,,,,,,,,,,,,,,,,,,,,,,,,,,,,,,,,,,,,,,,,,37.3600006103516,32.7599983215332,52.3699989318848,
Labor force with advanced education (% of total working-age population with advanced education),,,,,,,,,,,,,,,,,,,,,,,,,,,,,,,,,,,,,,,,,,,,,,,,,,,,,,,68.5999984741211,59.3800010681152,49.4500007629395,
"Labor force with advanced education, male (% of male working-age population with advanced education)",,,,,,,,,,,,,,,,,,,,,,,,,,,,,,,,,,,,,,,,,,,,,,,,,,,,,,,73.629997253418,64.1800003051758,57.0800018310547,
"Labor force with advanced education, female (% of female working-age population with advanced education)",,,,,,,,,,,,,,,,,,,,,,,,,,,,,,,,,,,,,,,,,,,,,,,,,,,,,,,77.370002746582,67.7799987792969,62.6100006103516,
"Labor force participation rate, total (% of total population ages 15-64) (modeled ILO estimate)",,,,,,,,,,,,,,,,,,,,,,,,,,,,,,,,,,,,,,,,,,,,,,,,,,,,,,,,,,
"Labor force participation rate, male (% of male population ages 15-64) (modeled ILO estimate)",,,,,,,,,,,,,,,,,,,,,,,,,,,,,,,,,,,,,,,,,,,,,,,,,,,,,,,,,,
"Labor force participation rate, female (% of female population ages 15-64) (modeled ILO estimate)",,,,,,,,,,,,,,,,,,,,,,,,,,,,,,,,,,,,,,,,,,,,,,,,,,,,,,,,,,
"Labor force participation rate for ages 15-24, total (%) (modeled ILO estimate)",,,,,,,,,,,,,,,,,,,,,,,,,,,,,,,,,,,,,,,,,,,,,,,,,,,,,,,,,,
"Labor force participation rate for ages 15-24, total (%) (national estimate)",,,,,,,,,,,,,,,,,,,,,,,,,,,,,,,,,,,,,,,,,,,,,,,,,,,,,,,23.0400009155273,20.2000007629395,21.2199993133545,
"Labor force participation rate for ages 15-24, male (%) (modeled ILO estimate)",,,,,,,,,,,,,,,,,,,,,,,,,,,,,,,,,,,,,,,,,,,,,,,,,,,,,,,,,,
"Labor force participation rate for ages 15-24, male (%) (national estimate)",,,,,,,,,,,,,,,,,,,,,,,,,,,,,,,,,,,,,,,,,,,,,,,,,,,,,,,30.6100006103516,28.0900001525879,28.7999992370605,
"Labor force participation rate for ages 15-24, female (%) (modeled ILO estimate)",,,,,,,,,,,,,,,,,,,,,,,,,,,,,,,,,,,,,,,,,,,,,,,,,,,,,,,,,,
"Labor force participation rate for ages 15-24, female (%) (national estimate)",,,,,,,,,,,,,,,,,,,,,,,,,,,,,,,,,,,,,,,,,,,,,,,,,,,,,,,14.8000001907349,11.4099998474121,12.7200002670288,
"Children in employment, total (% of children ages 7-14)",,,,,,,,,,,,,,,,,,,,,,,,,,,,,,,,,,,,,,,,,,,,,,,,,,,,,,,,,,
"Children in employment, work only (% of children in employment, ages 7-14)",,,,,,,,,,,,,,,,,,,,,,,,,,,,,,,,,,,,,,,,,,,,,,,,,,,,,,,,,,
"Average working hours of children, working only, ages 7-14 (hours per week)",,,,,,,,,,,,,,,,,,,,,,,,,,,,,,,,,,,,,,,,,,,,,,,,,,,,,,,,,,
"Children in employment, work only, male (% of male children in employment, ages 7-14)",,,,,,,,,,,,,,,,,,,,,,,,,,,,,,,,,,,,,,,,,,,,,,,,,,,,,,,,,,
"Average working hours of children, working only, male, ages 7-14 (hours per week)",,,,,,,,,,,,,,,,,,,,,,,,,,,,,,,,,,,,,,,,,,,,,,,,,,,,,,,,,,
"Children in employment, work only, female (% of female children in employment, ages 7-14)",,,,,,,,,,,,,,,,,,,,,,,,,,,,,,,,,,,,,,,,,,,,,,,,,,,,,,,,,,
"Average working hours of children, working only, female, ages 7-14 (hours per week)",,,,,,,,,,,,,,,,,,,,,,,,,,,,,,,,,,,,,,,,,,,,,,,,,,,,,,,,,,
"Children in employment, study and work (% of children in employment, ages 7-14)",,,,,,,,,,,,,,,,,,,,,,,,,,,,,,,,,,,,,,,,,,,,,,,,,,,,,,,,,,
"Average working hours of children, study and work, ages 7-14 (hours per week)",,,,,,,,,,,,,,,,,,,,,,,,,,,,,,,,,,,,,,,,,,,,,,,,,,,,,,,,,,
"Children in employment, study and work, male (% of male children in employment, ages 7-14)",,,,,,,,,,,,,,,,,,,,,,,,,,,,,,,,,,,,,,,,,,,,,,,,,,,,,,,,,,
"Average working hours of children, study and work, male, ages 7-14 (hours per week)",,,,,,,,,,,,,,,,,,,,,,,,,,,,,,,,,,,,,,,,,,,,,,,,,,,,,,,,,,
"Children in employment, study and work, female (% of female children in employment, ages 7-14)",,,,,,,,,,,,,,,,,,,,,,,,,,,,,,,,,,,,,,,,,,,,,,,,,,,,,,,,,,
"Average working hours of children, study and work, female, ages 7-14 (hours per week)",,,,,,,,,,,,,,,,,,,,,,,,,,,,,,,,,,,,,,,,,,,,,,,,,,,,,,,,,,
"Children in employment, male (% of male children ages 7-14)",,,,,,,,,,,,,,,,,,,,,,,,,,,,,,,,,,,,,,,,,,,,,,,,,,,,,,,,,,
"Children in employment, female (% of female children ages 7-14)",,,,,,,,,,,,,,,,,,,,,,,,,,,,,,,,,,,,,,,,,,,,,,,,,,,,,,,,,,
Employment in services (% of total employment) (modeled ILO estimate),,,,,,,,,,,,,,,,,,,,,,,,,,,,,,,,,,,,,,,,,,,,,,,,,,,,,,,,,,
"Employment in services, male (% of male employment) (modeled ILO estimate)",,,,,,,,,,,,,,,,,,,,,,,,,,,,,,,,,,,,,,,,,,,,,,,,,,,,,,,,,,
"GNI per capita, Atlas method (current US$)",,,,,,,,,,,,,,,,,,,,,,,,,,,,,,,,,,,,,,,,,,,,,,,2510,2800,3100,3280,3420,3640,3790,3950,3990,3980,3880,3890
"GNI, PPP (constant 2011 international $)",,,,,,,,,,,,,,,,,,,,,,,,,,,,,,,,,,,,,,,,,,,,,,,12318204796.4396,13479078243.4291,13699292348.64,13795228822.1443,14255266216.5128,15053591102.4272,15609725176.9909,16025004498.3075,16182031145.7451,16768788871.9247,17407281053.46,18446529679.3626
"GNI, PPP (current international $)",,,,,,,,,,,,,,,,,,,,,,,,,,,,,,,,,,,,,,,,,,,,,,,11301765527.734,12712758434.7194,13164787345.9209,13352545771.3184,13963587861.1042,15053591102.4272,15886467600.4817,16574498672.2112,17034610345.653,17845749725.0779,18759982610.4281,20221834664.9884
GNI (constant LCU),,,,,,,,,,,,,,,,,,,,,,,,,,,,,,,,,,,,,,,,,,,,,,,3638858076.08046,3981785782.4867,4046838108.57281,4075178213.09054,4211075514.31746,4446904598.70525,4611189330.29166,4733864877.35184,4780251318.69052,4953582427.06993,5142196147.14424,5449195285.24222
GNI growth (annual %),,,,,,,,,,,,,,,,,,,,,,,,,,,,,,,,,,,,,,,,,,,,,,,,9.4240473037525,1.63374751028107,0.700302402947472,3.3347572577413,5.60021029273818,3.69436150337579,2.66038842201286,0.979885200370006,3.62598317167327,3.80762252069518,5.97019501616009
GNI (constant 2010 US$),,,,,,,,,,,,,,,,,,,,,,,,,,,,,,,,,,,,,,,,,,,,,,,5114537135.59761,5596533534.62432,5687966761.90829,5727799729.82078,5918807947.01987,6250273638.87628,6481181342.04657,6653605940.08003,6718803639.97782,6962426329.30118,7227529242.20247,7659026832.81195
GNI (current LCU),,,,,,,,,,,,,,,,,,,,,,,,,,,,,,,,,,,,,,,,,,,,,,,3352700000,3719700000,4046800000,4131446200,4468700000,4921600000,5212700000,5449200000,5681300000,5899600000,6151700000,6497500000
GNI (current US$),,,,,,,,,,,,,,,,,,,,,,,,,,,,,,,,,,,,,,,,,,,,,,,4206122192.94944,5091294826.17027,5927640251.94082,5739714087.24646,5918807947.01987,6841256602.72449,6697545933.44469,7234731810.93999,7537879793.0211,6542752578.4629,6804977876.10619,7321951769.21343
"GNI, Atlas method (current US$)",,,,,,,,,,,,,,,,,,,,,,,,,,,,,,,,,,,,,,,,,,,,,,,4317554603.67595,4845940566.54288,5413881435.07626,5785799029.7908,6073447519.27297,6526462500.94792,6834402793.05951,7200295363.94908,7273757652.18752,7167361490.00945,7052305895.14612,7122379408.99143
Gross domestic income (constant LCU),,,,,,,,,,,,,,,,,,,,,,,,,,,,,,,,,,,,,,,,,,,,,,,3506355104.53522,3762413816.93684,3885019253.67731,4060587700.27289,4246724111.67533,4423918971.06109,4695350860.76714,4854735059.23319,4942333908.46923,5149266454.78778,5424944295.60603,5689494923.99324
Gross domestic savings (% of GDP),,,,,,,,,,,,,,,,,,,,,,,,,,,,,,,,,,,,,,,,,,,,,,,-8.4518411419079,-9.50614487172223,-7.45462570491426,-3.73501081187341,-2.61041439476552,0.671461832695786,-0.144294439722443,-0.086341197890272,-2.94387067804221,-0.878265511718817,-0.439810239177703,2.10717673095163
Gross domestic savings (current LCU),,,,,,,,,,,,,,,,,,,,,,,,,,,,,,,,,,,,,,,,,,,,,,,-274744000,-335699999.999999,-289451800,-152000000,-114899999.999999,32299999.9999981,-7299999.99999809,-4600000,-163900000,-51000000,-26700000,133300000
Gross domestic savings (current US$),,,,,,,,,,,,,,,,,,,,,,,,,,,,,,,,,,,,,,,,,,,,,,,-344679463.053569,-459485354.503147,-423980957.961038,-211169769.380384,-152185430.463575,44898526.5499,-9379416.67737131,-6107275.62400425,-217460528.061563,-56559831.429522,-29535398.2300885,150214108.631959
